{
  "$schema": "https://json-schema.org/draft/2020-12/schema",
  "$id": "https://raw.githubusercontent.com/conuti-gmbh/bo4e-schema/master/schemas/v1/bo/Berechnungsformel.schema.json",
  "title": "Berechnungsformel",
  "type": "object",
  "properties": {
    "boTyp": {
      "$ref": "../enum/BOTyp.schema.json",
      "default": "BERECHNUNGSFORMEL"
    },
    "versionStruktur": {
      "type": "string",
      "default": "1",
      "description": "versionStruktur"
    },
    "beginndatum": {
      "type": "string",
      "format": "date-time",
      "description": "Der inklusive Zeitpunkt ab dem die Berechnungsformel gültig ist"
    },
    "notwendigkeit": {
      "$ref": "../enum/BerechnungsformelNotwendigkeit.schema.json",
      "description": "Beschreibt ob eine Berechnungsformel notwendig ist"
    },
    "lieferrichtung": {
      "$ref": "../enum/Energierichtung.schema.json",
      "description": "The UTILTS 'Lieferrichtung der Marktlokation' is contained in the marktlokations-bo also the relation between Berechnungsformel↔ Marktlokation is modelled as 'link'"
    },
    "rechenschrittId": {
      "type": "integer",
      "faker": {
        "number.int": {
          "min": 1,
          "max": 10
        }
      },
      "description": "ID des Rechenschritts [1 - 99999]"
    },
    "rechenschritt": {
      "$ref": "../com/Rechenschritt.schema.json"
    },
    "rechenschritte": {
      "type": ["array", "null"],
      "items": {
        "$ref": "../com/Rechenschritt.schema.json"
      },
      "description": "Eine Berechnungsformel enthält, falls sie notwendig ist, einen oder mehrere Berechnungschritte, die hier rekursiv abgebildet werden."
    },
    "verwendungszweck": {
      "type": ["array", "null"],
      "items": {
        "$ref": "../com/Verwendungszweck.schema.json"
      },
      "description": "Verwendungszweck der Werte"
    },
    "gueltigkeitszeitraum": {
      "$ref": "../com/Zeitraum.schema.json",
      "description": "Gültigkeitszeitraum der Werte"
    },
    "lokationsId": {
      "type": "string",
      "faker": {
        "string.numeric": 11
      },
      "description": "Eindeutige Nummer der Lokation, zu der die Berechnungsformel gehört. Verwendung für notwendige interne Zuordnungen."
    },
    "lokationsTyp": {
      "$ref": "../enum/Lokationstyp.schema.json",
      "description": "Gibt an,um welchen Lokationstyp es sich handelt. Verwendung für notwendige interne Zuordnungen."
    },
    "berechnungsformel": {
      "type": "string",
      "description": "Berechnungsformel"
    },
    "keineBerechnungsformelZeitraum": {
      "type": "string",
      "format": "date-time",
      "description": "keineBerechnungsformelZeitraum"
    },
    "parameterIDs": {
      "type": ["array", "null"],
      "items": {
        "type": "string",
        "faker": {
          "lorem.sentence": 5
        }
      },
      "description": "Parameter IDs"
    },
    "aufteilungsfaktoren": {
      "type": ["array", "null"],
      "items": {
        "$ref": "../com/Aufteilungsfaktor.schema.json"
      },
      "description": "Aufteilungsfaktor"
    }
  },
  "required": [
    "boTyp",
    "versionStruktur"
  ]
}
