{
  "boTyp": "BERECHNUNGSFORMEL",
  "versionStruktur": "1",
  "beginndatum": "1964-12-05T16:58:01.0Z",
  "notwendigkeit": "BERECHNUNGSFORMEL_MUSS_ANGEFRAGT_WERDEN",
  "lieferrichtung": "EINSP",
  "rechenschrittId": 9,
  "rechenschritt": {
    "rechenschrittBestandteilId": 3,
    "referenzRechenschrittId": 1,
    "operation": "SUBTRAKTION",
    "verlustfaktorTrafo": 5.25,
    "verlustfaktorLeitung": 7,
    "aufteilungsfaktorEnergiemenge": 2.25,
    "messlokationsId": "235976085992504755955526967048073",
    "energieflussrichtung": "EINSP"
  },
  "rechenschritte": [
    {
      "rechenschrittBestandteilId": 5,
      "referenzRechenschrittId": 9,
      "operation": "SUBTRAKTION",
      "verlustfaktorTrafo": 6.25,
      "verlustfaktorLeitung": 7.5,
      "aufteilungsfaktorEnergiemenge": 2.25,
      "messlokationsId": "920906799706572143967310975155223",
      "energieflussrichtung": "AUSSP"
    }
  ],
  "verwendungszweck": [
    {
      "marktrolle": "INTERESSENT",
      "zweck": [
        "BLINDARBEITSABRECHNUNG"
      ]
    }
  ],
  "gueltigkeitszeitraum": {
    "zeiteinheit": "STUNDE",
    "dauer": 5,
    "startdatum": "1959-12-30T05:39:47.0Z",
    "enddatum": "1953-04-18T04:48:46.0Z",
    "einheit": "MONAT",
    "ableseZeitraum": "689002",
    "abrechnungsZeitraum": "542657",
    "zeitraumText": "ut ullamco",
    "zeitraumId": 9
  }
}